commit	tier	composite	graph	pos	width	explained	explained_junction	probe_score	seconds	status	description
fb6e415	1	0.759238	0.608675	0.687964	0.761496	0.782555	0.781049	0.842137	271.9	baseline	v0 baseline at the freeze (neuromimetic proposal + junction-aware joint fit, retarget) | tier 1 = 0.5 fast + 0.5 probes | digest a6bd0c1671b8bc41
fb6e415	2	0.753886	0.679220	0.772442	0.797316	0.915901	0.918413	-	1809.1	confirm	v0 baseline, tier 2 confirmation (10 dev images x2) | deterministic True | digest 1a78216250e2e602
898717e	1	0.752183	0.608381	0.634603	0.759191	0.816299	0.817746	0.831826	274.4	discard	E1 retarget early (joint fit + MDL on re-cleaned target) | pred: explained+, graph+, pos+ slightly, probes ~0; composite +0.003..0.01 | NOT held: explained +0.034 and expl_junction +0.037 held, but pos -0.053 (0.688->0.635), probes -0.010 (crossing_depth thr 5->50, crossing_width mean -0.07); cleaner target = more unexplained OD for neighbours to drift into
8a4af52	1	0.759045	0.607025	0.685852	0.761956	0.781817	0.780148	0.842974	269.4	discard	E2 anchor_px 4->1.5 (tighter positional prior) | pred: pos+, explained -<0.01, graph =/+, probes =/+; composite +0.003..0.01 | NOT held: everything within noise (pos 0.688->0.686, composite -0.0002); the prior is negligible against the precision-weighted data term, so the drift is data-driven
3834bb0	1	0.768662	0.609873	0.752170	0.767610	0.772376	0.769830	0.850362	269.7	keep	E3 final fit on the re-cleaned target with geometry frozen (profiles/optics only) | pred: pos +0.01..0.03, explained -<0.01, width =/+, graph =, probes =; composite +0.003..0.01 | HELD in direction, larger: pos +0.064, explained -0.010, width +0.006, graph +0.001, probes +0.008 (contrast, corner, empty 0.535->0.612; gap -0.02)
d9297b1	1	0.768156	0.609873	0.752170	0.764752	0.774382	0.772231	0.849492	273.8	discard	E4 retarget render support dilated 6 px instead of 3 | pred: explained+, expl_junction+, width+ slightly, pos/graph =, probes =; composite +0.002..0.006 | mostly NOT held: explained +0.002, expl_junction +0.002 (direction only), width -0.003, pos/graph identical, probes -0.001; the flank deficit is not the dilation's
3834bb0	2	0.760516	0.682873	0.803829	0.798456	0.912188	0.914838	-	1789.0	confirm	E3 (geometry frozen in the final fit), tier 2 confirmation (10 dev images x2) | +0.0066 vs 0.753886 (pos 0.772->0.804, graph +0.004, explained -0.004) | deterministic True | digest 6b9c2fb82341e0c5
34d262c	1	0.781836	0.603112	0.751474	0.770528	0.746258	0.768350	0.884072	277.6	keep	E5 wide edge removed unless both flanks (r+2s) observed in image+valid on >=50% of length | pred: empty 0.61->1.0, other probes =, fast =; composite +0.008..0.012 | PARTLY held: composite +0.0132, empty 1.0 (held) and thin/faint line probes up (line_d2.5 0.48->0.64, d3 0.66->0.74, h0.25 0.71->0.80: false wide edges at their corners), but fast -0.007 (NOT held): s007 avg explained 0.69->0.44, s008 avg graph 0.66->0.61: true wide vessels along the CROP border lost
7b44ac6	1	0.785308	0.609913	0.752170	0.767589	0.772348	0.769829	0.883641	342.6	keep	E6 (on E5) flank removal only for faint wide edges (mean a < 0.1) | pred: fast back to E3 0.687, probes ~0.883, composite ~0.785 | HELD: composite 0.785308 (+0.0035 vs E5), fast 0.6870 (E3 0.6867), probe_score 0.8836 (contrast sweep -0.007: line_d6_h0.5 blob kept), empty 1.0
b28c95d	1	0.786362	0.624815	0.756722	0.770352	0.773699	0.770484	0.876854	299.6	discard	E7 (on E6) nm_verify False: stage-7 graph as proposal, only the joint MDL judges | pred: recall/edge_cover/graph up (+0.01), precision down a little, probes ~=; composite +0.002..0.006 | PARTLY held: fast +0.009 (graph +0.015, recall up on 7/10 crops, pathologic avg +0.076) but frames lost precision (pathologic frame -0.046, s008 frame -0.021) and probes -0.007 (line_d3 false crossing, fork_thin_frame typed compound); composite +0.001 < 0.002
f0cf830	1	0.779753	0.603958	0.740894	0.770698	0.772453	0.769085	0.876854	286.7	discard	E8 (on E6) E7 + mdl_scale 0.25->0.5 | pred: graph +0.005..0.01, frames precision restored, probes back to ~0.884; composite +0.002..0.005 | NOT held: composite 0.779753 (-0.0056), probes identical to E7 (0.8769: the false probe edges pay any MDL cost), fast 0.6827 (below E6): the higher cost removes true faint vessels, not the false high-gain ones
7b44ac6	2	0.760600	0.683038	0.803839	0.798460	0.912187	0.914835	-	1799.5	confirm	E6 (E5+E6 flank test for faint one-flanked wide edges), tier 2 confirmation (10 dev images x2) | +0.00008 vs 0.760516: not regressed; whole images nearly unchanged (one faint one-flanked edge removed) | deterministic True | digest bcdbe0a268f3c3a7
be34189	1	0.785309	0.609913	0.752174	0.767594	0.772348	0.769829	0.883641	302.7	rebaseline	B3-R0 determinism fix: VESSELMAP_COMPILE=0 in set_threads (eager render; compile cache made digests depend on run history) | pred: scores within 1e-4 of E6 0.785308, digest changes, fresh-process digests equal in-run | HELD: composite 0.785309 (+1e-6), digest d56fee848ca3e349 (E6 had a different one), 303 s (not slower)
b527f79	1	0.785309	0.609913	0.752174	0.767594	0.772348	0.769829	0.883641	307.7	keep	E9 delete prune's node-core dual gain (site_mask) and min_gain_per_px (in-silico lesion: never decisive on 44 tier-1 cases) | pred: IDENTICAL digest d56fee848ca3e349, keep on simplicity (-29 lines) | HELD exactly: digest d56fee848ca3e349
b9eb2c0	1	0.787348	0.615320	0.754379	0.769639	0.765107	0.750848	0.885515	337.8	keep	E10 (on E9) stage-7 proposals (nm_verify False) + faint wide edge removed if soft (s >= 0.6 r) | pred: fast ~0.694, graph +0.01, probes ~0.881, composite +0.002..0.003; if mostly probes require tier 2 | PARTLY: composite +0.00204 (at the threshold; provisional keep, tier 2 decides), fast 0.6892 (below pred: soft rule removes true faint vessels, s007 avg expl_junction 0.52->0.39, pathologic avg -0.025 vs E7), probes 0.8855 (above pred: line_d3 +0.06, line_d5 +0.14), expl_junction -0.019 (not predicted), fork thr 4/5->3/5 (fork_thin_frame typed compound)
ba75eba	1	0.788777	0.615320	0.754379	0.770067	0.762865	0.747180	0.888675	331.1	keep	E11 (on E10) retarget renders the PRUNED network | pred: graph/pos identical, explained up slightly on lump probes, fast +-0.001, composite +0..0.002 | MOSTLY: composite +0.0014, graph/pos identical (held), probes +0.0032 (line_d2.5 expl -0.07->0.47, line_d3 +0.05), fast -0.0003 (held), but explained -0.002 overall (not held): where a TRUE edge was removed (s004 frame, s007 avg) its pixels now leak into B; kept as a correctness fix
b527f79	2	0.760603	0.683044	0.803793	0.798493	0.912199	0.914852	-	2269.0	confirm	B3 re-baseline: eager render (be34189) + E9 prune simplification, tier 2 (10 dev images x2) | pred: equal to 0.760600 within noise, new digest | HELD: +0.000003, deterministic True, digest cf65125bf2fb0dea; fresh-process digests equal in-run for pathologic avg+frame (the image the review found history-dependent)
ba75eba	2	0.749321	0.662791	0.805707	0.793865	0.907981	0.908730	-	2443.9	regress	E10+E11 (stage-7 proposals + soft wide-edge test + pruned retarget), tier 2 | pred: transfer of the tier-1 +0.0035 only if not probe-tuned | NOT held: -0.0113 vs 0.760603; graph -0.020 (junction_f1_strict -0.027, type balanced -0.042, recall -0.007; pathologic graph -0.07), explained -0.004; deterministic True digest 8eea31a4aaa98080; reset to b527f79
ba7302d	1	0.786641	0.609913	0.752174	0.769959	0.771415	0.768812	0.886067	345.4	discard	E12 (on E9) retarget renders the PRUNED network (E11 alone, without stage-7 proposals) | pred: graph/pos identical, probes +0.001..0.003, fast +-0.001, explained ~=, composite +0..0.002 | HELD in every part: graph/pos identical, probes +0.0024 (width mean, contrast), fast +0.0002, explained -0.0009, width +0.0024; +0.00133 < 0.002 and not simpler -> discard by the rule; digest 6b06db5deafe4875
17b48cc	1	0.786965	0.621124	0.752683	0.773360	0.775814	0.773310	0.879726	354.6	discard	E13 (on E9) re-propose arms from max(OD-R,0) via neuromimetic stages 3-6 (novel: 2xmin_len outside render support; attached to an edge; 20x MDL; revert if all rejected) | pred: probes ~=, fast up on crops with a real arm (pathologic avg), composite +0.002..0.008, whole images must not regress | PARTLY: fast +0.0072 (ALL from pathologic avg crop +0.072: one 146 px arm, junction F1 0.35->0.67), probes -0.0039 (capillary_average 0.94->0.81: a wide faint arm on the seed-11 bottom-right lump), 8/10 crops and 33/34 probes digest-identical; +0.00166 < 0.002 -> discard; whole-image check: pathologic avg/frame and s004 avg EXACT no-ops (20/11/9 arms proposed, all rejected); digest fdacd6f4068a66b0
ffc8257	1	0.788423	0.632534	0.748847	0.759913	0.791255	0.795384	0.877243	364.4	keep	E14 (on E9) E13 without the 20x re-proposal MDL cost (arms pay the ordinary cost; one parameter fewer) | pred: whole images graph up (jf1), fast up on pathologic avg +-elsewhere, probes -0.005..-0.015, composite -0.005..+0.003 | HELD/better: composite +0.00311 (keep), fast +0.0126 (6/10 crops up: s000 avg +0.015, s000 fra +0.013, s007 avg +0.030, path avg +0.073; s004 avg -0.007, s007 fra -0.006), graph +0.023, explained +0.019, expl_junction +0.026, pos -0.003, width -0.008, probes -0.0064 (fork_asym 0.98->0.89 two texture arms, capillary_avg 0.94->0.81 seed-11 lump arm, cross_wide_over_thin +0.007); tier 2 required (proposal change); digest 52706260f9c4721e
ffc8257	2	0.760839	0.684037	0.802285	0.791701	0.918937	0.921196	-	2556.6	confirm	E14 (residual re-proposal of arms, ordinary MDL cost), tier 2 (10 dev images x2) | pred: whole images up through junction F1 (path avg +0.002, s004 avg +0.005 recorded) | HELD weakly: +0.00024 vs 0.760603 (not regressed -> confirm); signal-detection signature on whole images: recall up 8/10, precision down 10/10, explained up 10/10 (+0.0067), expl_junction up 10/10 (+0.0063), jf1 strict up 7/10, type balance down 6/10, width -0.0068; per image -0.0062..+0.0054; controls (7 seeds) 0.6427->0.6056 (false arms on 10/42 fits) | deterministic True | digest c829ed334440a0f9
17b9c24	1	0.788423	0.632534	0.748847	0.759913	0.791255	0.795384	0.877243	393.9	discard	E15 (on E14) type nodes without a valid proposal type from their fitted arms (neuromimetic _type_of; export only) | pred: pos/width/explained identical, graph +0..+0.01 via coarse type balance, composite +0..+0.002 | PARTLY: every metric identical to 6 decimals (composite 0.788423); 9 of 44 digests changed but only the EXACT type (branch->pseudo-T, exact accuracy up on s000/s007 avg crops); no untyped degree-4 node paired into a crossing, so the coarse balance cannot move; equal and not simpler -> discard (first run crashed on wall clock under machine load, re-run)
167f2fb	1	0.787676	0.629729	0.746832	0.760798	0.791838	0.795754	0.877243	356.6	discard	E16 (on E14) CFAR acceptance for re-proposed arms (matched filter z vs the same template translated over the vessel-free background, Bonferroni alpha 0.05; passed arms skip MDL) | pred: probes +0..+0.005, fast +-0.002, precision up, composite +0..+0.003 | NOT held: composite -0.00075; probes IDENTICAL (34/34 digests: probe arms too wide/long to calibrate on small images, MDL decided); fast -0.0015 on 6 crops; CFAR is MORE permissive than MDL: precision DOWN (s008 avg 0.991->0.966, s008 frame 0.996->0.965, path frame 0.986->0.941), recall up; the clean-background null is narrower than the misfit-echo texture next to vessels where arms live
10d3d2d	1	0.789640	0.632543	0.748847	0.755170	0.797124	0.801603	0.879485	370.8	discard	E17 (on E14) two retarget/final-fit alternations (EM between B and the vessels; 2 x 30 iterations, same total) | pred: graph/pos identical, width up slightly, explained +0.005..0.02 (pathologic most), probes +-0.002, composite +0.001..0.004 | PARTLY: composite +0.00122 (below threshold, one parameter more -> discard); pos identical, graph +1e-5 (held); explained +0.0059 and expl_junction +0.0062 (held), target_fidelity up on 10/10 crops (+0.002..+0.034); width -0.0047 (NOT held: r grows into the recovered flank/halo OD, width bias s000 avg +0.006->+0.029, s004 avg +0.10->+0.14); probes +0.0022 (width sweep +0.023, line_d2.5 0.64->0.73); pathologic avg crop target_fidelity 0.25->0.26: its leak is an unrendered very wide structure, not flanks
63583c8	2	0.760839	0.684037	0.802285	0.791701	0.918937	0.921196	-	2468.7	confirm	B5 final kept state = E14 pipeline (no batch-5 change kept), tier 2 (10 dev images x2) through the tier2diag recording wrapper | pred: identical to E14 0.760839, digest c829ed334440a0f9 (the wrapper returns annotate output unchanged) | HELD exactly: 0.760839, digest c829ed334440a0f9, deterministic True; cross-batch reproduction of the confirmed state
ff0a51f	1	0.785309	0.609913	0.752174	0.767594	0.772348	0.769829	0.883641	285.8	keep	R0 (batch-6 review findings 1+2) repropose off by default: E14 re-labelled provisional (tier 2 +0.00024 +- 0.00127, t 0.19; controls 0.643 -> 0.606) | pred: E9 digest d56fee848ca3e349 exactly, composite 0.785309 | HELD exactly (kept by the review veto, not by tier 1: -0.0031 vs E14)
31b95c0	1	0.793358	0.628854	0.743620	0.801520	0.831422	0.854719	0.876196	352.1	discard	E18 coarse magnocellular channel: Hessian ridges (sigma 4-16) OR-ed into the retarget mask + coarse-channel deep edges (free ends) judged by joint fit/MDL on the stage-1 target | pred: tier 1 +-0.003, probes ~=, controls unchanged; tier 2 s004/pathologic up | NOT held on tier 1 (larger): +0.0080, fast +0.0235 (9/10 crops up, leave-one-out min +0.014), width +0.034, explained +0.059, pos -0.009; probes -0.0074 (line_d5_f25_h0.5 -0.11, cross_a30 -0.035: a false deep edge; explained -0.01..-0.02 on line probes); VETO: controls 0.6427 -> 0.6372, empty_average false_len 80.7 -> 94.5 (seed 2: 78 px deep edge, a 0.034), fork_wide seed 6 +119 px deep edge with 3 crossings
e0c9604	1	0.791564	0.614199	0.750428	0.793183	0.824127	0.846548	0.881404	345.4	discard	E19 (E18 + deep proposals merged against the network as the coarsest channel, median a >= 0.1) | pred: controls back to 0.6427 with empty false_len 80.7, probes ~0.88, fast ~E18, composite > R0 + 0.002 | PARTLY: empty false_len 80.7 (held: both false deep edges gone), probes 0.8814 (-0.0022 vs R0; held), fast 0.7017 (+0.0147, below E18 +0.0235), composite +0.0063; VETO: controls 0.6396 < 0.6427 (line_d3 0.661 -> 0.648, cross_a45 -0.004, fork_wide -0.002 at identical lengths: the ridge mask moves B off known lines)
3072e73	1	0.788501	0.608116	0.746298	0.784924	0.808671	0.828561	0.882961	341.4	keep	E20 (E19 + only NOVEL coarse ridges, < 50% in stage-1 mask, claim B) | pred: controls back to 0.6427 (line_d3 0.661), probes ~0.8836, fast +0.005..0.012, composite +0.003..0.006 | HELD: controls 0.64261 (line_d3 0.6608, empty false_len 80.7; -0.00005 from fork_wide/cross_a45 rounding-level, no false length: veto technically triggered, kept PROVISIONALLY, tier 2 judges), probes 0.8830 (-0.0007), fast +0.0071 (7 up 2 down, leave-one-out min +0.0041), composite +0.0032
3072e73	2	0.765183	0.687000	0.802254	0.806577	0.921266	0.925849	-	2132.9	regress	E20 (novel coarse ridges in the retarget mask + gated deep edges), tier 2 | pred: s004 and pathologic up, others within +-0.002 | HELD on every image (+0.0027..+0.0287 on the 4 hard images, others within +-0.0007), +0.00458 vs E9, paired SE 0.00281, t 1.63, 9 up 1 down: NOT confirmed (< 2 SE) -> the deep-edge part is provisional (Config.deep off, b4a46f6); deterministic True digest 4e65a9805c3ec08d
3072e73*	1	0.787735	0.609913	0.752174	0.773913	0.799228	0.805581	0.882961	287.7	discard	LESION (scratch b6/lesion_nodeep.py): E20 without deep edges (novel coarse ridges in the retarget mask only) | pred: graph/pos identical to R0, width/explained up | HELD: graph/pos identical, width +0.006, explained +0.027, composite +0.0024 vs R0; deep edges add +0.0008 on tier 1; digest 3f0cc5204d2f7ffa
b4a46f6	1	0.787735	0.609913	0.752174	0.773913	0.799228	0.805581	0.882961	287.3	keep	E20 tier-2 resolution: Config.deep off by default (deep edges provisional), novel coarse ridges stay | pred: digest = the lesion 3f0cc5204d2f7ffa | HELD exactly (so the lesion tier 2 below is this commit tier 2)
b4a46f6	2	0.761983	0.683044	0.803793	0.801276	0.917699	0.923383	-	1991.0	confirm	E20a (novel coarse ridges in the retarget mask; deep edges off), tier 2 run as the lesion of E20 (identical tier-1 digest) | pred: s004/pathologic up, others +-0.002 | HELD: +0.00138 vs E9 0.760603, paired SE 0.00054, t 2.53, 9 up 1 down (-0.00004): CONFIRMED (mean > 2 SE); +0.00114 vs E14 0.760839; deterministic True digest ee234d53452257f8
70c6072	1	0.785309	0.609913	0.752174	0.767594	0.772348	0.769829	0.883641	307.1	keep	R1 (batch-7 review findings 1+2) paired test per scene + materiality + guard vetoes; Config.coarse off (E20a provisional: per scene +0.00138 +- 0.00075, t 1.83; guards blur_err path +0.057, |contrast_bias| s004 +0.045) | pred: E9 digest d56fee848ca3e349 exactly | HELD exactly
1f862f7	1	0.784410	0.609913	0.752174	0.767566	0.766438	0.751995	0.882833	320.2	discard	E21 (on R1, coarse on) novel coarse ridges out of B AND out of the final fit's data term (FitConfig.ridge_w 0; review finding 2 remedy) | pred: graph/pos identical, width ~E20a, explained down vs E20a but >= E9, near-ridge contrast_bias back to ~-0.04, no guard veto, composite between R1 and E20a | PARTLY: graph/pos identical (held); near-ridge contrast_bias +0.376 -> -0.046 on pathologic avg (held); explained 0.7664 < E9 0.7723 (NOT held: profiles inside the ridge mask drift with no data, near blur_bias -0.22, s000 avg in-ridge explained -0.009); width 0.76757 = E9 (not E20a); probes 0.8828; composite -0.0009 vs R1, -0.0033 vs E20a; per scene vs R1 t -0.95, guards contrast_rel/|contrast_bias|/width_rel veto; first run 3c90cc8 0.779913 was a render bug (vesselmap renders no zero-weight pixel; fixed 1f862f7) | digest a19dca6426d49ca3
b4a46f6	2	0.761983	0.683044	0.803793	0.801276	0.917699	0.923383	-	1991.0	regress	E20a tier 2 RE-JUDGED under the batch-7 rule (review finding 1: per scene, n 5; guards) | the 'confirm' row above counted average and frame as independent images (t 2.53) | per scene +0.00138 +- 0.00075, t 1.83, 2 scenes up beyond 5e-4; guards veto (blur_err_px pathologic +0.057, |contrast_bias| s004 +0.045): PROVISIONAL -> Config.coarse off (R1 70c6072)
70c6072	2	0.760603	0.683044	0.803793	0.798493	0.912199	0.914852	-	2000.8	confirm	R1 tier 2 (re-run after the container restart) | pred: = E9 tier 2 (digest cf65125bf2fb0dea) | HELD exactly
5776d29	1	0.792582	0.640521	0.779846	0.758017	0.786046	0.780482	0.877585	280.4	rebaseline	R2 re-baseline: only the averaged still is fitted (fastset.KINDS = average; 10 average crops, 2 per dev scene; 30 average probes) | pipeline unchanged (R1 = E9) | digest 0783c0701f43a5a3
5776d29	2	0.766486	0.701367	0.802073	0.774042	0.918701	0.921326	-	965.9	rebaseline	R2 re-baseline tier 2 (5 dev averages x2) | deterministic True | digest 21cb3fd3c6e238b6 | every image identical to R1's average row
5776d29*	1	0.798682	0.668132	0.784195	0.761260	0.789039	0.783631	0.874215	282.0	keep	E7 re-test on the average-only evaluator (r2_variants:annotate_e7; stage-7 proposals, stage 8 with 0 rounds) | flipped by the R2 re-judgement | tier 1 +0.0061, controls 0.6199 >= 0.6181 (pass); tier 2 not confirmed (next rows)
5776d29*	1	0.789340	0.695051	0.784917	0.781852	0.796046	0.791242	0.837353	294.9	discard	V1-only proposer (r2_variants:annotate_v1own; surround, association off at V1's own thresholds) | pred from a held-out ablation, judged on dev only | NOT held: crops +0.034 but probes -0.040 (empty probe 207 px false), controls 0.5616
5776d29*	2	0.761857	0.694317	0.802959	0.766433	0.918798	0.920928	-	980.5	regress	E7 re-test tier 2 (5 dev averages x2) | paired per scene vs R2: -0.00463 +- 0.00249, t -1.86, 2 up 3 down; guard vetoes contrast_rel_err, |contrast_bias|, width_rel_err | provisional added code: not adopted | deterministic True, digest 2f6e3d2904ca9774
32247c8	1	0.791730	0.641093	0.780809	0.762442	0.785598	0.779163	0.874772	272.5	discard	E22 continuity (gap bridges between free ends, cross-trace continuation at nodes) | pred: crops +, probes =, composite +0.001..0.004 | NOT held: crops +0.0011 but probes -0.0028 (line_d6_h0.25: a cross-trace link made two false pieces one edge that survived the prune); controls identical
4f35978*	1	0.787753	0.637660	0.768625	0.762520	0.787389	0.783540	0.870254	280.2	discard	E23 mask term (BCE of the soft-thresholded render against the target OD's hysteresis mask, mask_w 1) with the OD match | pred: pos+, width+, graph =, composite 0..+0.005 | NOT held: pos -0.011 (9/10 crops), probes -0.007 (width sweep)
4f35978*	1	0.783882	0.648421	0.767920	0.725348	0.788365	0.786291	0.863280	356.7	discard	E23b mask-only geometry stage (60 it, a and s held) then the OD match with the mask term | pred: pos+, graph changed | NOT held: graph +0.008 all on one crop, width -0.033 (8/10), pos -0.012, probes -0.014, blur guard worse
4f35978*	1	0.792795	0.640788	0.779058	0.757325	0.786403	0.781201	0.878065	288.2	discard	E23w mask term at weight 0.1 (dose-response) | null: crops -0.00005, probes +0.0005; no weight helps
638a026*	2	0.766486	0.701367	0.802073	0.774042	0.918701	0.921326	-	551.7	rebaseline	E24 baseline check: R2 tier 2 re-run on the current code (5 dev averages x1, two scene groups in parallel) | every image's digest = R2's (2339ead, d3df92f, ca98958, a59bca0, ec1d442)
