commit	tier	composite	graph	pos	width	explained	explained_junction	probe_score	seconds	status	description
638a026*	2	0.769035	0.701367	0.802073	0.781145	0.926893	0.931059	-	544.0	regress	E24 retarget: OD hysteresis mask (pipeline.od_bg_mask) added to the retarget's background mask only (Config.od_mask retarget) | paired per scene vs R2 +0.0025 +- 0.0014, t 1.86, 3 up 0 down; graph and pos unchanged (geometry frozen in the final stage); explained +0.008; guard vetoes blur_err +0.059, |contrast_bias| +0.060, |blur_bias|: the B the larger mask leaves sits ~+0.002 OD high on empty background (selection bias of dark texture), absorbed as darker, blurrier vessels | x1 per image
638a026*	2	0.753450	0.695807	0.728209	0.762905	0.942162	0.951509	-	555.2	regress	E24 target: the fit's target from B fitted outside stage 1's mask OR the OD mask, proposals unchanged (Config.od_mask target) | paired -0.0130 +- 0.0049, t -2.68, 0 up 5 down; pos -0.074 (every scene), centreline F1 -0.016, explained +0.024, contrast_bias +0.21 (E1's lesson again: a changed target before the joint fit drags the geometry) | x1 per image
638a026*	2	0.734345	0.681352	0.713417	0.695523	0.953075	0.959484	-	636.2	regress	E24 stage1: the proposer's stage 1 with the OD mask (photoreceptors extra=), everything downstream on its OD (Config.od_mask stage1) | paired -0.0321 +- 0.0127, t -2.54, 0 up 4 down; coarse type -0.073 (pathologic -0.25), pos -0.089, width -0.079, contrast_bias +0.30; explained +0.034 | x1 per image
